{
  "units": "mm",
  "origin": "world",

  "stock": {
    "type": "cylinder",
    "params": {
      "dia": 50.0,
      "h": 80.0
    }
  },

  "csys_list": [
    {
      "name": "WCS",
      "role": "world",
      "origin": {
        "x": 0.0,
        "y": 0.0,
        "z": 0.0
      },
      "rpy_deg": {
        "r": 0.0,
        "p": 0.0,
        "y": 0.0
      }
    }
  ],

  "operations": [
    {
      "op": "lathe:turn_od_profile",
      "name": "OdProfile",
      "selector": null,
      "csys_ref": "WCS",
      "params": {
        "profile": [
          { "z": 0.0,  "d": 50.0 },
          { "z": 20.0, "d": 50.0 },
          { "z": 20.0, "d": 40.0 },
          { "z": 40.0, "d": 40.0 },
          { "z": 40.0, "d": 30.0 },
          { "z": 80.0, "d": 30.0 }
        ]
      },
      "feature": {
        "feature_type": "turn_od_profile",
        "id": "L3_F1_TURN_OD_PROFILE",
        "metadata": {
          "source": {
            "primary_standard": "ISO 10303-238",
            "reference_standards": [
              "ISO 14649-12",
              "ISO 10303-224"
            ]
          }
        },
        "params": {
          "csys_id": "WCS",
          "profile": [
            { "z": 0.0,  "radius": 25.0 },
            { "z": 20.0, "radius": 25.0 },
            { "z": 20.0, "radius": 20.0 },
            { "z": 40.0, "radius": 20.0 },
            { "z": 40.0, "radius": 15.0 },
            { "z": 80.0, "radius": 15.0 }
          ]
        }
      }
    }
  ],

  "output_mode": "step",
  "file_template_solid": "case3_{step:02d}_{name}_solid.step",
  "file_template_removed": "case3_{step:02d}_{name}_removed.step",
  "dry_run": false
}
