{
  "units": "mm",
  "origin": "world",

  "stock": {
    "type": "block",
    "params": {
      "w": 80,
      "d": 60,
      "h": 30
    }
  },

  "operations": [
    {
      "op": "mill:pocket_profile",
      "name": "RectPocket",
      "selector": ">Z",
      "params": {
        "profile_type": "rect",
        "center": { "x": 0.0, "y": 0.0 },
        "size":   { "x": 40.0, "y": 30.0 },
        "depth": 10.0,
        "corner_radius": 4.0
      }
    }
  ],

  "output_mode": "step",
  "file_template_solid": "pocket_{step:02d}_{name}_solid.step",
  "file_template_removed": "pocket_{step:02d}_{name}_removed.step",
  "dry_run": false
}
