{
  "units": "mm",
  "origin": "world",

  "stock": {
    "type": "block",
    "params": {
      "w": 100,
      "d": 50,
      "h": 25
    }
  },

  "operations": [
    {
      "op": "mill:hole_pattern",
      "name": "SideHoleLine",
      "selector": ">Z",
      "params": {
        "pattern": "line",
        "dia": 6.0,
        "depth": 20.0,
        "count": 5,
        "start": { "x": -30.0, "y": 0.0 },
        "end":   { "x":  30.0, "y": 0.0 }
      }
    }
  ],

  "output_mode": "step",
  "file_template_solid": "holes_{step:02d}_{name}_solid.step",
  "file_template_removed": "holes_{step:02d}_{name}_removed.step",
  "dry_run": false
}
